Product Name,Role Assigned,Price (CAD),Total Score,Sources Count,CNN Underscored - Label,CNN Underscored - Points,Good Housekeeping - Label,Good Housekeeping - Points,HGTV - Label,HGTV - Points,The Spruce - Label,The Spruce - Points,Wirecutter - Label,Wirecutter - Points,Why Picked
Conair Turbo ExtremeSteam Handheld Garment Steamer (GS59X),Best Overall,49.97,6.0,3,Best clothes steamer,2.0,,,Best Overall,2.0,,,Best Overall,2.0,Highest weighted score (6.0 pts from 3 source(s)).
CHI Steam Handheld Garment Steamer,Best For Specific Use Case,59.98,4.5,3,Best travel clothes steamer,1.5,Best for Travel,1.5,,,Best for Travel,1.5,,,Top for 'Best for Travel' (4.5 pts from 3 source(s)).
Beautural Foldable Handheld Garment Steamer,,,4.5,3,,,,,Best Foldable,1.5,Best Value,1.5,Best Travel Garment Steamer,1.5,
Conair ExtremeSteam Handheld Fabric Steamer,,69.99,3.5,2,,,Best Overall,2.0,,,"Best Overall, Runner-Up",1.5,,,
Electrolux Handheld Garment and Fabric Steamer,,79.99,3.5,2,,,,,Best Handheld,1.5,Best Overall,2.0,,,
Polardo Travel Handheld Garment Steamer,Best Budget,32.99,3.0,2,,,,,Best Travel,1.5,Most Compact,1.5,,,Highest score under $40 (3.0 pts from 2 source(s)).
Black+Decker Advanced Handheld Garment Steamer,,73.48,2.5,2,Mentioned,1.0,Most Versatile,1.5,,,,,,,
Conair Turbo ExtremeSteam 2-in-1 Handheld Steamer & Iron,,79.99,2.5,2,Mentioned,1.0,,,Best Steamer/Iron Combo,1.5,,,,,
Steamery Cirrus 3 Garment Steamer,Best Upgrade,250.0,2.5,2,Mentioned,1.0,,,,,Best Design,1.5,,,Highest score above $100 (2.5 pts from 2 source(s)).
Reliable Vivio 500GC Professional Garment Steamer,Best Canadian Option,279.0,2.5,2,Mentioned,1.0,Best Value Upright,1.5,,,,,,,Made/assembled in Canada.
Sunbeam Power Steam Handheld Steamer,,59.98,1.5,1,,,Best Steamer and Iron,1.5,,,,,,,
CHI SteamPress 3-in-1 Steamer & Iron,,79.99,1.5,1,,,,,,,Most Versatile,1.5,,,
Hilife Handheld Portable Clothes Steamer,,84.08,1.5,1,,,,,Best Value,1.5,,,,,
Rowenta Duo Force 2-in-1 Handheld Steamer,,99.99,1.5,1,,,,,,,Best Iron-Steamer Combo,1.5,,,
Salav Adjustable Standing Garment Steamer,,153.99,1.5,1,,,,,Best Versatile,1.5,,,,,
Jiffy J-2000 Garment Steamer,,469.73,1.5,1,Best upright clothes steamer,1.5,,,,,,,,,
Laurastar IZZI Plus Garment and Hard Surfaces Steamer,,1099.0,1.5,1,,,Best Luxury Upright Steamer,1.5,,,,,,,
Pure Enrichment Upright Clothes Steamer,,,1.5,1,,,,,,,Best Standing,1.5,,,
Conair Turbo ExtremeSteam Full-Size Professional Steam & Press,,129.97,1.0,1,Mentioned,1.0,,,,,,,,,
Jiffy Esteam Personal Handheld Steamer,,146.0,1.0,1,Mentioned,1.0,,,,,,,,,
Sundu 2-in-1 Portable Steamer,,155.97,1.0,1,Mentioned,1.0,,,,,,,,,
Steamery Cumulus Home Steamer,,515.0,1.0,1,Mentioned,1.0,,,,,,,,,
Rowenta PureTex 4-in-1 Handheld Steamer,,,1.0,1,Mentioned,1.0,,,,,,,,,
